{
  "$schema": "https://json-schema.org/draft/2020-12/schema",
  "$id": "schema.simplified.json",
  "title": "Nanoindentation Experiment: PMDCo (Simplified Input)",
  "description": "User-friendly form for a nanoindentation experiment session. Enter test conditions as individual fields and summary statistics as a results array. The transform converts this to full OO-LD (MeasurementDatum + ScalarValueSpecification nodes).",
  "type": "object",
  "required": ["experiment_name", "specimen_iri"],
  "additionalProperties": false,
  "properties": {
    "experiment_name": {
      "title": "Experiment Name",
      "description": "Human-readable name for this measurement session.",
      "type": "string",
      "minLength": 1,
      "examples": ["AA2618 2hr aged Set 2", "316L nanoindentation RT"]
    },
    "experiment_id": {
      "title": "Experiment ID",
      "description": "Optional IRI slug for the RDF node. Auto-derived from experiment_name if omitted.",
      "type": "string"
    },
    "specimen_iri": {
      "title": "Specimen IRI (pre-test)",
      "description": "IRI of the pre-test specimen KItem — input to this experiment (obi:has_specified_input).",
      "type": "string",
      "format": "uri",
      "x-kitem": {"ktypeIds": ["specimen"]},
      "examples": ["https://example.materials-data.space/knowledge/aa2618-2hr-set2-specimen"]
    },
    "specimen_post_iri": {
      "title": "Post-test Specimen IRI",
      "description": "IRI of the post-test specimen KItem — output of this experiment (obi:has_specified_output).",
      "type": "string",
      "format": "uri",
      "x-kitem": {"ktypeIds": ["specimen"]}
    },
    "dataset_iris": {
      "title": "Dataset IRIs",
      "description": "IRIs of dataset KItems produced by this experiment (obi:has_specified_output).",
      "type": "array",
      "items": {"type": "string", "format": "uri", "x-kitem": {"ktypeIds": ["nanoindentation-dataset", "dataset"]}},
      "default": []
    },
    "test_date": {
      "title": "Test Date",
      "description": "Date the measurement session was conducted (ISO 8601).",
      "type": "string",
      "format": "date-time",
      "examples": ["2026-07-16T00:00:00"]
    },
    "instrument_serial": {
      "title": "Instrument Serial Number",
      "description": "Serial number of the nanoindenter used.",
      "type": "string",
      "examples": ["1000136225"]
    },
    "control_mode": {
      "title": "Control Mode",
      "description": "Feedback control mode used during loading.",
      "type": "string",
      "enum": ["Depth-controlled", "Load-controlled", "Constant Strain Rate", "Oscillating (CSM)"],
      "default": "Constant Strain Rate"
    },
    "indenter_geometry": {
      "title": "Indenter Geometry",
      "description": "Geometry of the indenter tip.",
      "type": "string",
      "enum": ["Berkovich", "Cube Corner", "Spherical", "Conical", "Vickers", "Flat Punch", "Other"],
      "default": "Berkovich"
    },
    "indenter_material": {
      "title": "Indenter Material",
      "type": "string",
      "examples": ["Diamond", "Sapphire"]
    },
    "analysis_method": {
      "title": "Analysis Method",
      "description": "Method used to extract hardness and modulus from the load-displacement curve.",
      "type": "string",
      "enum": ["Oliver & Pharr", "Doerner & Nix", "ISO 14577", "Continuous Stiffness (CSM)"],
      "default": "Oliver & Pharr"
    },
    "test_standard": {
      "title": "Test Standard",
      "description": "Standard or norm followed.",
      "type": "string",
      "examples": ["ISO 14577-1:2015", "ASTM E2546"]
    },
    "test_conditions": {
      "title": "Test Protocol Parameters",
      "description": "Numeric test protocol parameters as PMDCo ParameterSpecification nodes. Each entry: name (parameter label or IRI), value (number), unit (short code or QUDT IRI).",
      "type": "array",
      "items": {
        "title": "Parameter",
        "type": "object",
        "required": ["name", "value", "unit"],
        "additionalProperties": false,
        "properties": {
          "name": {
            "title": "Parameter Name",
            "description": "Label matching the process-parameter vocabulary.",
            "type": "string",
            "examples": [
              "Max Indentation Depth",
              "Maximum Load",
              "Loading Rate",
              "Hold Time at Maximum Load",
              "Data Acquisition Rate",
              "Assumed Poisson's Ratio"
            ]
          },
          "value": {
            "title": "Value",
            "type": "number",
            "exclusiveMinimum": 0
          },
          "unit": {
            "title": "Unit",
            "description": "Short code (um, mN, 1/s, s, Hz, -) or full QUDT IRI.",
            "type": "string",
            "examples": ["um", "mN", "1/s", "s", "Hz", "-"]
          }
        }
      },
      "default": []
    },
    "unload_fit_range": {
      "title": "Unload Fit Range",
      "description": "Percentage range of the unloading curve used for Oliver-Pharr fit, e.g. '40%-98%'.",
      "type": "string",
      "examples": ["40%-98%", "20%-80%"]
    },
    "tip_area_function": {
      "title": "Tip Area Function Reference",
      "description": "Description of the tip area function used, e.g. 'Factory calibration — Berkovich'.",
      "type": "string",
      "examples": ["Factory calibration — Berkovich area function"]
    },
    "test_temperature": {
      "title": "Test Temperature (°C)",
      "description": "Ambient temperature during testing in degrees Celsius.",
      "type": "number",
      "examples": [23.0, 25.0]
    },
    "test_humidity": {
      "title": "Relative Humidity (%)",
      "description": "Ambient relative humidity during testing in percent.",
      "type": "number",
      "minimum": 0,
      "maximum": 100,
      "examples": [45.0, 50.0]
    },
    "summary_results": {
      "title": "Summary Statistics",
      "description": "Aggregate results across all valid indentations. Add one entry per statistic.",
      "type": "array",
      "items": {
        "title": "Summary Result",
        "type": "object",
        "required": ["name", "value", "unit"],
        "additionalProperties": false,
        "properties": {
          "name": {
            "title": "Property Name",
            "description": "Name of the summary statistic.",
            "type": "string",
            "examples": [
              "Mean Hardness HIT",
              "Std Dev Hardness HIT",
              "Mean Elastic Modulus EIT",
              "Std Dev Elastic Modulus EIT",
              "Mean Maximum Depth hmax",
              "Number of Valid Indentations"
            ]
          },
          "value": {
            "title": "Value",
            "type": "number",
            "examples": [1.45, 0.21, 83.7]
          },
          "unit": {
            "title": "Unit",
            "type": "string",
            "description": "Short code (GPa, um, -) or full QUDT IRI.",
            "examples": ["GPa", "um", "-", "http://qudt.org/vocab/unit/GigaPA"]
          }
        }
      },
      "default": []
    }
  },
  "examples": [
    {
      "experiment_name": "AA2618 2hr aged Set 2",
      "specimen_iri": "https://example.materials-data.space/knowledge/aa2618-2hr-set2-specimen",
      "test_date": "2026-07-16T00:00:00",
      "instrument_serial": "1000136225",
      "control_mode": "Constant Strain Rate",
      "indenter_geometry": "Berkovich",
      "indenter_material": "Diamond",
      "analysis_method": "Oliver & Pharr",
      "test_standard": "ISO 14577-1:2015",
      "test_conditions": [
        { "name": "Max Indentation Depth",  "value": 1.0,  "unit": "um" },
        { "name": "Loading Rate",           "value": 0.2,  "unit": "1/s" },
        { "name": "Hold Time at Maximum Load", "value": 10.0, "unit": "s" },
        { "name": "Data Acquisition Rate",  "value": 10.0, "unit": "Hz" },
        { "name": "Assumed Poisson's Ratio","value": 0.33, "unit": "-" }
      ],
      "summary_results": [
        { "name": "Mean Hardness HIT",           "value": 1.450, "unit": "GPa" },
        { "name": "Std Dev Hardness HIT",         "value": 0.211, "unit": "GPa" },
        { "name": "Mean Elastic Modulus EIT",     "value": 83.710, "unit": "GPa" },
        { "name": "Std Dev Elastic Modulus EIT",  "value": 3.907,  "unit": "GPa" },
        { "name": "Mean Maximum Depth hmax",      "value": 1.004,  "unit": "um" },
        { "name": "Number of Valid Indentations", "value": 27,     "unit": "-" }
      ]
    }
  ]
}
